CNAE,Descrição
4774100,COMÉRCIO VAREJISTA DE ARTIGOS DE ÓPTICA                                                                                  
4783101,COMÉRCIO VAREJISTA DE ARTIGOS DE JOALHERIA                                                                               
6920601,ATIVIDADES DE CONTABILIDADE                                                                                              
4782201,COMÉRCIO VAREJISTA DE CALÇADOS                                                                                           
6010100,ATIVIDADES DE RÁDIO                                                                                                      
4929902,"TRANSPORTE RODOVIÁRIO COLETIVO DE PASSAGEIROS, SOB REGIME DE FRETAMENTO, INTERMUNICIPAL, INTERESTADUAL E INTERNACIONAL   "
7311400,AGÊNCIAS DE PUBLICIDADE                                                                                                  
4781400,COMÉRCIO VAREJISTA DE ARTIGOS DO VESTUÁRIO E ACESSÓRIOS                                                                  
4744005,COMÉRCIO VAREJISTA DE MATERIAIS DE CONSTRUÇÃO NÃO ESPECIFICADOS ANTERIORMENTE                                            
4511101,"COMÉRCIO A VAREJO DE AUTOMÓVEIS, CAMIONETAS E UTILITÁRIOS NOVOS                                                          "
9491000,ATIVIDADES DE ORGANIZAÇÕES RELIGIOSAS                                                                                    
4712100,"COMÉRCIO VAREJISTA DE MERCADORIAS EM GERAL, COM PREDOMINÂNCIA DE PRODUTOS ALIMENTÍCIOS - MINIMERCADOS, MERCEARIAS E ARMAZ"
4637107,"COMÉRCIO ATACADISTA DE CHOCOLATES, CONFEITOS, BALAS, BOMBONS E SEMELHANTES                                               "
4789099,COMÉRCIO VAREJISTA DE OUTROS PRODUTOS NÃO ESPECIFICADOS ANTERIORMENTE                                                    
4642702,COMÉRCIO ATACADISTA DE ROUPAS E ACESSÓRIOS PARA USO PROFISSIONAL E DE SEGURANÇA DO TRABALHO                              
4789007,COMÉRCIO VAREJISTA DE EQUIPAMENTOS PARA ESCRITÓRIO                                                                       
4711302,"COMÉRCIO VAREJISTA DE MERCADORIAS EM GERAL, COM PREDOMINÂNCIA DE PRODUTOS ALIMENTÍCIOS - SUPERMERCADOS                   "
4530703,COMÉRCIO A VAREJO DE PEÇAS E ACESSÓRIOS NOVOS PARA VEÍCULOS AUTOMOTORES                                                  
4722901,COMÉRCIO VAREJISTA DE CARNES - AÇOUGUES                                                                                  
4744099,COMÉRCIO VAREJISTA DE MATERIAIS DE CONSTRUÇÃO EM GERAL                                                                   
8112500,CONDOMÍNIOS PREDIAIS                                                                                                     
4672900,COMÉRCIO ATACADISTA DE FERRAGENS E FERRAMENTAS                                                                           
4669999,COMÉRCIO ATACADISTA DE OUTRAS MÁQUINAS E EQUIPAMENTOS NÃO ESPECIFICADOS ANTERIORMENTE (PARTES E PEÇAS)
4731800,COMÉRCIO VAREJISTA DE COMBUSTÍVEIS PARA VEÍCULOS AUTOMOTORES                                                             
4520001,SERVIÇOS DE MANUTENÇÃO E REPARAÇÃO MECÂNICA DE VEÍCULOS AUTOMOTORES                                                      
4754701,COMÉRCIO VAREJISTA DE MÓVEIS                                                                                             
4763602,COMÉRCIO VAREJISTA DE ARTIGOS ESPORTIVOS                                                                                 
4772500,"COMÉRCIO VAREJISTA DE COSMÉTICOS, PRODUTOS DE PERFUMARIA E DE HIGIENE PESSOAL                                            "
4541203,COMÉRCIO A VAREJO DE MOTOCICLETAS E MOTONETAS NOVAS                                                                      
6550200,PLANOS DE SAÚDE                                                                                                          
4647801,COMÉRCIO ATACADISTA DE ARTIGOS DE ESCRITÓRIO E DE PAPELARIA                                                              
1095300,"FABRICAÇÃO DE ESPECIARIAS, MOLHOS, TEMPEROS E CONDIMENTOS                                                                "
4761001,COMÉRCIO VAREJISTA DE LIVROS                                                                                             
8219901,FOTOCÓPIAS                                                                                                               
6491300,SOCIEDADES DE FOMENTO MERCANTIL - FACTORING                                                                              
4721104,"COMÉRCIO VAREJISTA DE DOCES, BALAS, BOMBONS E SEMELHANTES                                                                "
5819100,"EDIÇÃO DE CADASTROS, LISTAS E OUTROS PRODUTOS GRÁFICOS                                                                   "
7911200,AGÊNCIAS DE VIAGENS                                                                                                      
4742300,COMÉRCIO VAREJISTA DE MATERIAL ELÉTRICO                                                                                  
2599399,FABRICAÇÃO DE OUTROS PRODUTOS DE METAL NÃO ESPECIFICADOS ANTERIORMENTE                                                   
2399102,FABRICAÇÃO DE ABRASIVOS                                                                                                  
1610202,SERRARIAS SEM DESDOBRAMENTO DE MADEIRA                                                                                   
7739099,"ALUGUEL DE OUTRAS MÁQUINAS E EQUIPAMENTOS COMERCIAIS E INDUSTRIAIS NÃO ESPECIFICADOS ANTERIORMENTE, SEM OPERADOR         "
4753900,COMÉRCIO VAREJISTA ESPECIALIZADO DE ELETRODOMÉSTICOS E EQUIPAMENTOS DE ÁUDIO E VÍDEO                                     
8121400,LIMPEZA EM PRÉDIOS E EM DOMICÍLIOS                                                                                       
6436100,"SOCIEDADES DE CRÉDITO, FINANCIAMENTO E INVESTIMENTO - FINANCEIRAS                                                        "
4689301,"COMÉRCIO ATACADISTA DE PRODUTOS DA EXTRAÇÃO MINERAL, EXCETO COMBUSTÍVEIS                                                 "
4743100,COMÉRCIO VAREJISTA DE VIDROS                                                                                             
2091600,FABRICAÇÃO DE ADESIVOS E SELANTES                                                                                        
4771701,"COMÉRCIO VAREJISTA DE PRODUTOS FARMACÊUTICOS, SEM MANIPULAÇÃO DE FÓRMULAS                                                "
1813001,IMPRESSÃO DE MATERIAL PARA USO PUBLICITÁRIO                                                                              
4789002,COMÉRCIO VAREJISTA DE PLANTAS E FLORES NATURAIS                                                                          
5611201,RESTAURANTES E SIMILARES                                                                                                 
8599601,FORMAÇÃO DE CONDUTORES                                                                                                   
4771702,"COMÉRCIO VAREJISTA DE PRODUTOS FARMACÊUTICOS, COM MANIPULAÇÃO DE FÓRMULAS                                                "
4759899,COMÉRCIO VAREJISTA DE OUTROS ARTIGOS DE USO DOMÉSTICO NÃO ESPECIFICADOS ANTERIORMENTE                                    
2330399,"FABRICAÇÃO DE OUTROS ARTEFATOS E PRODUTOS DE CONCRETO, CIMENTO, FIBROCIMENTO, GESSO E MATERIAIS SEMELHANTES              "
8299799,OUTRAS ATIVIDADES DE SERVIÇOS PRESTADOS PRINCIPALMENTE ÀS EMPRESAS NÃO ESPECIFICADAS ANTERIORMENTE                       
4639701,COMÉRCIO ATACADISTA DE PRODUTOS ALIMENTÍCIOS EM GERAL                                                                    
6622300,"CORRETORES E AGENTES DE SEGUROS, DE PLANOS DE PREVIDÊNCIA COMPLEMENTAR E DE SAÚDE                                        "
4732600,COMÉRCIO VAREJISTA DE LUBRIFICANTES                                                                                      
4763601,COMÉRCIO VAREJISTA DE BRINQUEDOS E ARTIGOS RECREATIVOS                                                                   
4511102,"COMÉRCIO A VAREJO DE AUTOMÓVEIS, CAMIONETAS E UTILITÁRIOS USADOS                                                         "
4689399,COMÉRCIO ATACADISTA ESPECIALIZADO EM OUTROS PRODUTOS INTERMEDIÁRIOS NÃO ESPECIFICADOS ANTERIORMENTE                      
4721102,PADARIA E CONFEITARIA COM PREDOMINÂNCIA DE REVENDA                                                                       
4744001,COMÉRCIO VAREJISTA DE FERRAGENS E FERRAMENTAS                                                                            
4755501,COMÉRCIO VAREJISTA DE TECIDOS                                                                                            
1099604,FABRICAÇÃO DE GELO COMUM                                                                                                 
6821801,CORRETAGEM NA COMPRA E VENDA E AVALIAÇÃO DE IMÓVEIS                                                                      
2539001,"SERVIÇOS DE USINAGEM, TORNEARIA E SOLDA                                                                                  "
4321500,INSTALAÇÃO E MANUTENÇÃO ELÉTRICA                                                                                         
4633801,"COMÉRCIO ATACADISTA DE FRUTAS, VERDURAS, RAÍZES, TUBÉRCULOS, HORTALIÇAS E LEGUMES FRESCOS                                "
4754702,COMÉRCIO VAREJISTA DE ARTIGOS DE COLCHOARIA                                                                              
5620102,SERVIÇOS DE ALIMENTAÇÃO PARA EVENTOS E RECEPÇÕES - BUFÊ                                                                  
6821802,CORRETAGEM NO ALUGUEL DE IMÓVEIS                                                                                         
4723700,COMÉRCIO VAREJISTA DE BEBIDAS                                                                                            
4713002,"LOJAS DE VARIEDADES, EXCETO LOJAS DE DEPARTAMENTOS OU MAGAZINES                                                          "
4686902,COMÉRCIO ATACADISTA DE EMBALAGENS                                                                                        
4930203,TRANSPORTE RODOVIÁRIO DE PRODUTOS PERIGOSOS                                                                              
4930202,"TRANSPORTE RODOVIÁRIO DE CARGA, EXCETO PRODUTOS PERIGOSOS E MUDANÇAS, INTERMUNICIPAL, INTERESTADUAL E INTERNACIONAL      "
4632001,COMÉRCIO ATACADISTA DE CEREAIS E LEGUMINOSAS BENEFICIADOS                                                                
5510801,HOTÉIS                                                                                                                   
4789004,COMÉRCIO VAREJISTA DE ANIMAIS VIVOS E DE ARTIGOS E ALIMENTOS PARA ANIMAIS DE ESTIMAÇÃO                                   
4744002,COMÉRCIO VAREJISTA DE MADEIRA E ARTEFATOS                                                                                
2829199,"FABRICAÇÃO DE OUTRAS MÁQUINAS E EQUIPAMENTOS DE USO GERAL NÃO ESPECIFICADOS ANTERIORMENTE, PEÇAS E ACESSÓRIOS            "
3314707,MANUTENÇÃO E REPARAÇÃO DE MÁQUINAS E APARELHOS DE REFRIGERAÇÃO E VENTILAÇÃO PARA USO INDUSTRIAL E COMERCIAL              
8630501,ATIVIDADE MÉDICA AMBULATORIAL COM RECURSOS PARA REALIZAÇÃO DE PROCEDIMENTOS CIRÚRGICOS                                   
2029100,FABRICAÇÃO DE PRODUTOS QUÍMICOS ORGÂNICOS NÃO ESPECIFICADOS ANTERIORMENTE                                                
1413402,"CONFECÇÃO, SOB MEDIDA, DE ROUPAS PROFISSIONAIS                                                                           "
7112000,SERVIÇOS DE ENGENHARIA                                                                                                   
8219999,PREPARAÇÃO DE DOCUMENTOS E SERVIÇOS ESPECIALIZADOS DE APOIO ADMINISTRATIVO NÃO ESPECIFICADOS ANTERIORMENTE               
5223100,ESTACIONAMENTO DE VEÍCULOS                                                                                               
4784900,COMÉRCIO VAREJISTA DE GÁS LIQÜEFEITO DE PETRÓLEO (GLP)                                                                   
7020400,"ATIVIDADES DE CONSULTORIA EM GESTÃO EMPRESARIAL, EXCETO CONSULTORIA TÉCNICA ESPECÍFICA                                   "
4329101,INSTALAÇÃO DE PAINÉIS PUBLICITÁRIOS                                                                                      
8291100,ATIVIDADES DE COBRANÇA E INFORMAÇÕES CADASTRAIS                                                                          
4663000,COMÉRCIO ATACADISTA DE MÁQUINAS E EQUIPAMENTOS PARA USO INDUSTRIAL (PARTES E PEÇAS)
4520006,SERVIÇOS DE BORRACHARIA PARA VEÍCULOS AUTOMOTORES                                                                        
1741902,"FABRICAÇÃO DE PRODUTOS DE PAPEL, CARTOLINA, PAPEL-CARTÃO E PAPELÃO ONDULADO PARA USO COMERCIAL E DE ESCRITÓRIO           "
8512100,EDUCAÇÃO INFANTIL - PRÉ-ESCOLA                                                                                           
4530704,COMÉRCIO A VAREJO DE PEÇAS E ACESSÓRIOS USADOS PARA VEÍCULOS AUTOMOTORES                                                 
1412601,"CONFECÇÃO DE PEÇAS DO VESTUÁRIO, EXCETO ROUPAS ÍNTIMAS E AS CONFECCIONADAS SOB MEDIDA                                    "
1813099,IMPRESSÃO DE MATERIAL PARA OUTROS USOS                                                                                   
4761003,COMÉRCIO VAREJISTA DE ARTIGOS DE PAPELARIA                                                                               
8511200,EDUCAÇÃO INFANTIL - CRECHE                                                                                               
5829800,"EDIÇÃO INTEGRADA À IMPRESSÃO DE CADASTROS, LISTAS E OUTROS PRODUTOS GRÁFICOS                                             "
4520002,SERVIÇOS DE LANTERNAGEM OU FUNILARIA E PINTURA DE VEÍCULOS AUTOMOTORES                                                   
8111700,"SERVIÇOS COMBINADOS PARA APOIO A EDIFÍCIOS, EXCETO CONDOMÍNIOS PREDIAIS                                                  "
3811400,COLETA DE RESÍDUOS NÃO-PERIGOSOS                                                                                         
5611203,"LANCHONETES, CASAS DE CHÁ, DE SUCOS E SIMILARES                                                                          "
6424703,COOPERATIVAS DE CRÉDITO MÚTUO                                                                                            
7732201,"ALUGUEL DE MÁQUINAS E EQUIPAMENTOS PARA CONSTRUÇÃO SEM OPERADOR, EXCETO ANDAIMES                                         "
2391503,"APARELHAMENTO DE PLACAS E EXECUÇÃO DE TRABALHOS EM MÁRMORE, GRANITO, ARDÓSIA E OUTRAS PEDRAS                             "
8513900,ENSINO FUNDAMENTAL                                                                                                       
6201501,DESENVOLVIMENTO DE PROGRAMAS DE COMPUTADOR SOB ENC
9529102,CHAVEIROS                                                                                                                
4652400,COMÉRCIO ATACADISTA DE COMPONENTES ELETRÔNICOS E EQUIPAMENTOS DE TELEFONIA E COMUNICAÇÃO                                 
4530705,COMÉRCIO A VAREJO DE PNEUMÁTICOS E CÂMARAS-DE-AR                                                                         
4789001,"COMÉRCIO VAREJISTA DE SUVENIRES, BIJUTERIAS E ARTESANATOS                                                                "
4313400,OBRAS DE TERRAPLENAGEM                                                                                                   
1081302,TORREFAÇÃO E MOAGEM DE CAFÉ                                                                                              
9511800,REPARAÇÃO E MANUTENÇÃO DE COMPUTADORES E DE EQUIPAMENTOS PERIFÉRICOS                                                     
4751201,COMÉRCIO VAREJISTA ESPECIALIZADO DE EQUIPAMENTOS E SUPRIMENTOS DE INFORMÁTICA                                            
4773300,COMÉRCIO VAREJISTA DE ARTIGOS MÉDICOS E ORTOPÉDICOS                                                                      
8630503,ATIVIDADE MÉDICA AMBULATORIAL RESTRITA A CONSULTAS                                                                       
6911703,AGENTE DE PROPRIEDADE INDUSTRIAL                                                                                         
4752100,COMÉRCIO VAREJISTA ESPECIALIZADO DE EQUIPAMENTOS DE TELEFONIA E COMUNICAÇÃO                                              
4661300,"COMÉRCIO ATACADISTA DE MÁQUINAS, APARELHOS E EQUIPAMENTOS PARA USO AGROPECUÁRIO (PARTES E PEÇAS)"
4729699,COMÉRCIO VAREJISTA DE PRODUTOS ALIMENTÍCIOS EM GERAL OU ESPECIALIZADO EM PRODUTOS ALIMENTÍCIOS NÃO ESPECIFICADOS ANTERIOR
9430800,ATIVIDADES DE ASSOCIAÇÕES DE DEFESA DE DIREITOS SOCIAIS                                                                  
1062700,MOAGEM DE TRIGO E FABRICAÇÃO DE DERIVADOS                                                                                
4645101,"COMÉRCIO ATACADISTA DE INSTRUMENTOS E MATERIAIS PARA USO MÉDICO, CIRÚRGICO, HOSPITALAR E DE LABORATÓRIOS                 "
4930201,"TRANSPORTE RODOVIÁRIO DE CARGA, EXCETO PRODUTOS PERIGOSOS E MUDANÇAS, MUNICIPAL                                          "
1099699,FABRICAÇÃO DE OUTROS PRODUTOS ALIMENTÍCIOS NÃO ESPECIFICADOS ANTERIORMENTE                                               
8593700,ENSINO DE IDIOMAS                                                                                                        
9312300,"CLUBES SOCIAIS, ESPORTIVOS E SIMILARES                                                                                   "
9313100,ATIVIDADES DE CONDICIONAMENTO FÍSICO                                                                                     
3314702,"MANUTENÇÃO E REPARAÇÃO DE EQUIPAMENTOS HIDRÁULICOS E PNEUMÁTICOS, EXCETO VÁLVULAS                                        "
3314708,"MANUTENÇÃO E REPARAÇÃO DE MÁQUINAS, EQUIPAMENTOS E APARELHOS PARA TRANSPORTE E ELEVAÇÃO DE CARGAS                        "
2330302,FABRICAÇÃO DE ARTEFATOS DE CIMENTO PARA USO NA CONSTRUÇÃO                                                                
9603304,SERVIÇOS DE FUNERÁRIAS                                                                                                   
4110700,INCORPORAÇÃO DE EMPREENDIMENTOS IMOBILIÁRIOS                                                                             
4729602,COMÉRCIO VAREJISTA DE MERCADORIAS EM LOJAS DE CONVENIÊNCIA                                                               
4754703,COMÉRCIO VAREJISTA DE ARTIGOS DE ILUMINAÇÃO                                                                              
6202300,DESENVOLVIMENTO E LICENCIAMENTO DE PROGRAMAS DE COMPUTADOR CUSTOMIZÁVEIS                                                 
2790201,"FABRICAÇÃO DE ELETRODOS, CONTATOS E OUTROS ARTIGOS DE CARVÃO E GRAFITA PARA USO ELÉTRICO, ELETROÍMÃS E ISOLADORES        "
5320202,SERVIÇOS DE ENTREGA RÁPIDA                                                                                               
2093200,FABRICAÇÃO DE ADITIVOS DE USO INDUSTRIAL                                                                                 
8712300,ATIVIDADES DE FORNECIMENTO DE INFRA-ESTRUTURA DE APOIO E ASSISTÊNCIA A PACIENTE NO DOMICÍLIO                             
6311900,"TRATAMENTO DE DADOS, PROVEDORES DE SERVIÇOS DE APLICAÇÃO E SERVIÇOS DE HOSPEDAGEM NA INTERNET                            "
4687702,"COMÉRCIO ATACADISTA DE RESÍDUOS E SUCATAS NÃO-METÁLICOS, EXCETO DE PAPEL E PAPELÃO                                       "
8690999,OUTRAS ATIVIDADES DE ATENÇÃO À SAÚDE HUMANA NÃO ESPECIFICADAS ANTERIORMENTE                                              
7319002,PROMOÇÃO DE VENDAS                                                                                                       
6203100,DESENVOLVIMENTO E LICENCIAMENTO DE PROGRAMAS DE COMPUTADOR NÃO-CUSTOMIZÁVEIS                                             
4530701,COMÉRCIO POR ATACADO DE PEÇAS E ACESSÓRIOS NOVOS PARA VEÍCULOS AUTOMOTORES                                               
7820500,LOCAÇÃO DE MÃO-DE-OBRA TEMPORÁRIA                                                                                        
4120400,CONSTRUÇÃO DE EDIFÍCIOS                                                                                                  
7111100,SERVIÇOS DE ARQUITETURA                                                                                                  
6209100,"SUPORTE TÉCNICO, MANUTENÇÃO E OUTROS SERVIÇOS EM TECNOLOGIA DA INFORMAÇÃO                                                "
1091101,FABRICAÇÃO DE PRODUTOS DE PANIFICAÇÃO INDUSTRIAL                                                                         
4679699,COMÉRCIO ATACADISTA DE MATERIAIS DE CONSTRUÇÃO EM GERAL                                                                  
4789006,COMÉRCIO VAREJISTA DE FOGOS DE ARTIFÍCIO E ARTIGOS PIROTÉCNICOS                                                          
9412099,OUTRAS ATIVIDADES ASSOCIATIVAS PROFISSIONAIS
4541205,COMÉRCIO A VAREJO DE PEÇAS E ACESSÓRIOS PARA MOTOCICLETAS E MOTONETAS                                                    
3211602,FABRICAÇÃO DE ARTEFATOS DE JOALHERIA E OURIVESARIA                                                                       
4649410,"COMÉRCIO ATACADISTA DE JÓIAS, RELÓGIOS E BIJUTERIAS, INCLUSIVE PEDRAS PRECIOSAS E SEMIPRECIOSAS LAPIDADAS                "
8800600,SERVIÇOS DE ASSISTÊNCIA SOCIAL SEM ALOJAMENTO                                                                            
5620101,FORNECIMENTO DE ALIMENTOS PREPARADOS PREPONDERANTEMENTE PARA EMPRESAS                                                    
4789008,COMÉRCIO VAREJISTA DE ARTIGOS FOTOGRÁFICOS E PARA FILMAGEM                                                               
3600602,DISTRIBUIÇÃO DE ÁGUA POR CAMINHÕES                                                                                       
8630504,ATIVIDADE ODONTOLÓGICA                                                                                                   
4530702,COMÉRCIO POR ATACADO DE PNEUMÁTICOS E CÂMARAS-DE-AR                                                                      
8211300,SERVIÇOS COMBINADOS DE ESCRITÓRIO E APOIO ADMINISTRATIVO                                                                 
7490104,"ATIVIDADES DE INTERMEDIAÇÃO E AGENCIAMENTO DE SERVIÇOS E NEGÓCIOS EM GERAL, EXCETO IMOBILIÁRIOS                          "
4763603,COMÉRCIO VAREJISTA DE BICICLETAS E TRICICLOS (PEÇAS E ACESSÓRIOS)
2342702,"FABRICAÇÃO DE ARTEFATOS DE CERÂMICA E BARRO COZIDO PARA USO NA CONSTRUÇÃO, EXCETO AZULEJOS E PISOS                       "
1122401,FABRICAÇÃO DE REFRIGERANTES                                                                                              
4757100,"COMÉRCIO VAREJISTA ESPECIALIZADO DE PEÇAS E ACESSÓRIOS PARA APARELHOS ELETROELETRÔNICOS PARA USO DOMÉSTICO, EXCETO INFORM"
9601701,LAVANDERIAS                                                                                                              
8520100,ENSINO MÉDIO                                                                                                             
1822999,"SERVIÇOS DE ACABAMENTOS GRÁFICOS, EXCETO ENCADERNAÇÃO E PLASTIFICAÇÃO                                                    "
6911701,SERVIÇOS ADVOCATÍCIOS                                                                                                    
3316301,"MANUTENÇÃO E REPARAÇÃO DE AERONAVES, EXCETO A MANUTENÇÃO NA PISTA                                                        "
8541400,EDUCAÇÃO PROFISSIONAL DE NÍVEL TÉCNICO                                                                                   
8230001,"SERVIÇOS DE ORGANIZAÇÃO DE FEIRAS, CONGRESSOS, EXPOSIÇÕES E FESTAS                                                       "
9602502,ATIVIDADES DE ESTÉTICA E OUTROS SERVIÇOS DE CUIDADOS COM A BELEZA                                                        
4649401,COMÉRCIO ATACADISTA DE EQUIPAMENTOS ELÉTRICOS DE USO PESSOAL E DOMÉSTICO                                                 
6190601,PROVEDORES DE ACESSO ÀS REDES DE COMUNICAÇÕES                                                                            
6822600,GESTÃO E ADMINISTRAÇÃO DA PROPRIEDADE IMOBILIÁRIA                                                                        
9602501,CABELEIREIROS                                                                                                            
1091102,FABRICAÇÃO DE PRODUTOS DE PADARIA E CONFEITARIA COM PREDOMINÂNCIA DE PRODUÇÃO PRÓPRIA                                    
1733800,FABRICAÇÃO DE CHAPAS E DE EMBALAGENS DE PAPELÃO ONDULADO                                                                 
4691500,"COMÉRCIO ATACADISTA DE MERCADORIAS EM GERAL, COM PREDOMINÂNCIA DE PRODUTOS ALIMENTÍCIOS                                  "
8020001,ATIVIDADES DE MONITORAMENTO DE SISTEMAS DE SEGURAN
5811500,EDIÇÃO DE LIVROS                                                                                                         
1032599,"FABRICAÇÃO DE CONSERVAS DE LEGUMES E OUTROS VEGETAIS, EXCETO PALMITO                                                     "
8129000,ATIVIDADES DE LIMPEZA NÃO ESPECIFICADAS ANTERIORMENTE                                                                    
6810203,LOTEAMENTO DE IMÓVEIS PRÓPRIOS                                                                                           
