CNAE,Descrição
6810201,COMPRA E VENDA DE IMÓVEIS PRÓPRIOS                                                                                       
6462000,HOLDINGS DE INSTITUIÇÕES NÃO-FINANCEIRAS                                                                                 
5229002,SERVIÇOS DE REBOQUE DE VEÍCULOS                                                                                          
2229399,FABRICAÇÃO DE ARTEFATOS DE MATERIAL PLÁSTICO PARA OUTROS USOS NÃO ESPECIFICADOS ANTERIORMENTE                            
4741500,COMÉRCIO VAREJISTA DE TINTAS E MATERIAIS PARA PINTURA                                                                    
7420001,"ATIVIDADES DE PRODUÇÃO DE FOTOGRAFIAS, EXCETO AÉREA E SUBMARINA                                                          "
6399200,OUTRAS ATIVIDADES DE PRESTAÇÃO DE SERVIÇOS DE INFORMAÇÃO NÃO ESPECIFICADAS ANTERIORMENTE                                 
7119799,ATIVIDADES TÉCNICAS RELACIONADAS À ENGENHARIA E ARQUITETURA NÃO ESPECIFICADAS ANTERIORMENTE                              
7912100,OPERADORES TURÍSTICOS                                                                                                    
8599605,CURSOS PREPARATÓRIOS PARA CONCURSOS                                                                                      
4623109,COMÉRCIO ATACADISTA DE ALIMENTOS PARA ANIMAIS                                                                            
2814301,"FABRICAÇÃO DE COMPRESSORES PARA USO INDUSTRIAL, PEÇAS E ACESSÓRIOS                                                       "
7500100,ATIVIDADES VETERINÁRIAS                                                                                                  
7120100,TESTES E ANÁLISES TÉCNICAS                                                                                               
6190699,OUTRAS ATIVIDADES DE TELECOMUNICAÇÕES NÃO ESPECIFICADAS ANTERIORMENTE                                                    
8599699,OUTRAS ATIVIDADES DE ENSINO NÃO ESPECIFICADAS ANTERIORMENTE                                                              
8640202,LABORATÓRIOS CLÍNICOS                                                                                                    
3101200,FABRICAÇÃO DE MÓVEIS COM PREDOMINÂNCIA DE MADEIRA                                                                        
4744004,"COMÉRCIO VAREJISTA DE CAL, AREIA, PEDRA BRITADA, TIJOLOS E TELHAS                                                        "
3313901,"MANUTENÇÃO E REPARAÇÃO DE GERADORES, TRANSFORMADORES E MOTORES ELÉTRICOS                                                 "
4930204,TRANSPORTE RODOVIÁRIO DE MUDANÇAS                                                                                        
4759801,"COMÉRCIO VAREJISTA DE ARTIGOS DE TAPEÇARIA, CORTINAS E PERSIANAS                                                         "
5620104,FORNECIMENTO DE ALIMENTOS PREPARADOS PREPONDERANTEMENTE PARA CONSUMO DOMICILIAR                                          
2950600,RECONDICIONAMENTO E RECUPERAÇÃO DE MOTORES PARA VEÍCULOS AUTOMOTORES                                                     
7312200,"AGENCIAMENTO DE ESPAÇOS PARA PUBLICIDADE, EXCETO EM VEÍCULOS DE COMUNICAÇÃO                                              "
8299706,CASAS LOTÉRICAS                                                                                                          
7740300,GESTÃO DE ATIVOS INTANGÍVEIS NÃO-FINANCEIROS                                                                             
9609206,SERVIÇOS DE TATUAGEM E COLOCAÇÃO DE PIERCING                                                                             
2219600,FABRICAÇÃO DE ARTEFATOS DE BORRACHA NÃO ESPECIFICADOS ANTERIORMENTE                                                      
4724500,COMÉRCIO VAREJISTA DE HORTIFRUTIGRANJEIROS                                                                               
9329802,EXPLORAÇÃO DE BOLICHES                                                                                                   
6319400,"PORTAIS, PROVEDORES DE CONTEÚDO E OUTROS SERVIÇOS DE INFORMAÇÃO NA INTERNET                                              "
8599604,TREINAMENTO EM DESENVOLVIMENTO PROFISSIONAL E GERENCIAL                                                                  
7119703,SERVIÇOS DE DESENHO TÉCNICO RELACIONADOS À ARQUITETURA E ENGENHARIA                                                      
9603301,GESTÃO E MANUTENÇÃO DE CEMITÉRIOS                                                                                        
4649408,"COMÉRCIO ATACADISTA DE PRODUTOS DE HIGIENE, LIMPEZA E CONSERVAÇÃO DOMICILIAR                                             "
4634601,COMÉRCIO ATACADISTA DE CARNES BOVINAS E SUÍNAS E DERIVADOS                                                               
4755502,COMERCIO VAREJISTA DE ARTIGOS DE ARMARINHO                                                                               
8122200,IMUNIZAÇÃO E CONTROLE DE PRAGAS URBANAS                                                                                  
4744003,COMÉRCIO VAREJISTA DE MATERIAIS HIDRÁULICOS                                                                              
1352900,FABRICAÇÃO DE ARTEFATOS DE TAPEÇARIA                                                                                     
1821100,SERVIÇOS DE PRÉ-IMPRESSÃO                                                                                                
4721103,COMÉRCIO VAREJISTA DE LATICÍNIOS E FRIOS                                                                                 
6920602,ATIVIDADES DE CONSULTORIA E AUDITORIA CONTÁBIL E TRIBUTÁRIA                                                              
4330401,IMPERMEABILIZAÇÃO EM OBRAS DE ENGENHARIA CIVIL                                                                           
6204000,CONSULTORIA EM TECNOLOGIA DA INFORMAÇÃO                                                                                  
4789005,COMÉRCIO VAREJISTA DE PRODUTOS SANEANTES DOMISSANITÁRIOS                                                                 
3250706,SERVIÇOS DE PRÓTESE DENTÁRIA                                                                                             
8650003,ATIVIDADES DE PSICOLOGIA E PSICANÁLISE                                                                                   
5310502,ATIVIDADES DE FRANQUEADAS E PERMISSIONÁRIAS DO CORREIO NACIONAL                                                          
5212500,CARGA E DESCARGA                                                                                                         
6201502,WEB DESIGN
2522500,"FABRICAÇÃO DE CALDEIRAS GERADORAS DE VAPOR, EXCETO PARA AQUECIMENTO CENTRAL E PARA VEÍCULOS                              "
3250707,FABRICAÇÃO DE ARTIGOS ÓPTICOS                                                                                            
8630502,ATIVIDADE MÉDICA AMBULATORIAL COM RECURSOS PARA REALIZAÇÃO DE EXAMES COMPLEMENTARES                                      
1411801,CONFECÇÃO DE ROUPAS ÍNTIMAS                                                                                              
4637199,COMÉRCIO ATACADISTA ESPECIALIZADO EM OUTROS PRODUTOS ALIMENTÍCIOS NÃO ESPECIFICADOS ANTERIORMENTE                        
2071100,"FABRICAÇÃO DE TINTAS, VERNIZES, ESMALTES E LACAS                                                                         "
3250705,FABRICAÇÃO DE MATERIAIS PARA MEDICINA E ODONTOLOGIA                                                                      
4221905,MANUTENÇÃO DE ESTAÇÕES E REDES DE TELECOMUNICAÇÕES                                                                       
4330404,SERVIÇOS DE PINTURA DE EDIFÍCIOS EM GERAL                                                                                
5620103,CANTINAS - SERVIÇOS DE ALIMENTAÇÃO PRIVATIVOS                                                                            
6492100,SECURITIZAÇÃO DE CRÉDITOS                                                                                                
8599603,TREINAMENTO EM INFORMÁTICA                                                                                               
6911702,ATIVIDADES AUXILIARES DA JUSTIÇA                                                                                         
5912099,"ATIVIDADES DE PÓS-PRODUÇÃO CINEMATOGRÁFICA, DE VÍDEOS E DE PROGRAMAS DE TELEVISÃO NÃO ESPECIFICADAS ANTERIORMENTE        "
4399199,SERVIÇOS ESPECIALIZADOS PARA CONSTRUÇÃO NÃO ESPECIFICADOS ANTERIORMENTE                                                  
5911199,"ATIVIDADES DE PRODUÇÃO CINEMATOGRÁFICA, DE VÍDEOS E DE PROGRAMAS DE TELEVISÃO NÃO ESPECIFICADAS ANTERIORMENTE            "
5510802,APART-HOTÉIS                                                                                                             
7319003,MARKETING DIRETO                                                                                                         
4612500,"REPRESENTANTES COMERCIAIS E AGENTES DO COMÉRCIO DE COMBUSTÍVEIS, MINERAIS, PRODUTOS SIDERÚRGICOS E QUÍMICOS              "
121101,"HORTICULTURA, EXCETO MORANGO                                                                                             "
4299599,OUTRAS OBRAS DE ENGENHARIA CIVIL NÃO ESPECIFICADAS ANTERIORMENTE                                                         
3839499,RECUPERAÇÃO DE MATERIAIS NÃO ESPECIFICADOS ANTERIORMENTE                                                                 
3321000,INSTALAÇÃO DE MÁQUINAS E EQUIPAMENTOS INDUSTRIAIS                                                                        
4312600,PERFURAÇÕES E SONDAGENS                                                                                                  
4637106,COMÉRCIO ATACADISTA DE SORVETES                                                                                          
7729202,"ALUGUEL DE MÓVEIS, UTENSÍLIOS E APARELHOS DE USO DOMÉSTICO E PESSOAL; INSTRUMENTOS MUSICAIS                              "
4785799,COMÉRCIO VAREJISTA DE OUTROS ARTIGOS USADOS                                                                              
6810202,ALUGUEL DE IMÓVEIS PRÓPRIOS                                                                                              
4618402,REPRESENTANTES COMERCIAIS E AGENTES DO COMÉRCIO DE INSTRUMENTOS E MATERIAIS ODONTO-MÉDICO-HOSPITALARES                   
1099601,FABRICAÇÃO DE VINAGRES                                                                                                   
3329501,SERVIÇOS DE MONTAGEM DE MÓVEIS DE QUALQUER MATERIAL                                                                      
8591100,ENSINO DE ESPORTES                                                                                                       
4619200,REPRESENTANTES COMERCIAIS E AGENTES DO COMÉRCIO DE MERCADORIAS EM GERAL NÃO ESPECIALIZADO                                
2710402,"FABRICAÇÃO DE TRANSFORMADORES, INDUTORES, CONVERSORES, SINCRONIZADORES E SEMELHANTES, PEÇAS E ACESSÓRIOS                 "
5813100,EDIÇÃO DE REVISTAS                                                                                                       
2543800,FABRICAÇÃO DE FERRAMENTAS                                                                                                
5240199,"ATIVIDADES AUXILIARES DOS TRANSPORTES AÉREOS, EXCETO OPERAÇÃO DOS AEROPORTOS E CAMPOS DE ATERRISSAGEM                    "
5812302,EDICAO DE JORNAIS NAO DIARIOS
7319004,CONSULTORIA EM PUBLICIDADE                                                                                               
8532500,EDUCAÇÃO SUPERIOR - GRADUAÇÃO E PÓS-GRADUAÇÃO                                                                            
8592903,ENSINO DE MÚSICA                                                                                                         
4744006,COMÉRCIO VAREJISTA DE PEDRAS PARA REVESTIMENTO                                                                           
